<?xml version="1.0"?>
<!DOCTYPE protocol SYSTEM "application/src/main/resources/protocols-config.dtd">
<protocol name="NAO_IDENTIFICADO" type="NAO_IDENTIFICADO">
    <Command>
        <key>QSG</key>
        <alias>isNobreakVoltronic</alias>
        <description>Resgata medidores e status do UPS</description>
        <products>
            <product id="20833" vendor="1637"/>
        </products>
        <Request beanType="ComandoNobreak" tipoNoBreak="5">
            <param name="Comando" type="char" value="Q"/>
            <param name="Param1" type="char" value="G"/>
            <param name="Param2" type="char" value="S"/>
            <param name="CaracterInicial" type="char" value="("/>
            <param name="TamanhoResposta" type="int" value="76"/>
        </Request>
        <Response beanType="MedidorEstadoBean" validation="false" start="1">
        </Response>
    </Command>

    <Command>
        <key>G1</key>
        <alias>isNobreakTrifasico</alias>
        <description>Detecta se o no-break é trifásico</description>
        <products>
            <product id="21760" vendor="1204"/>
        </products>
        <Request beanType="ComandoNobreak" tipoNoBreak="1">
            <param name="Comando" type="binary" value="71"/>
            <param name="Param1" type="binary" value="1"/>
            <param name="Param2" type="binary" value="-1"/>
            <param name="Param3" type="binary" value="-1"/>
            <param name="Param4" type="binary" value="-1"/>
            <param name="Check" type="check" calc="(({Comando})+({Param1})+({Param2})+({Param3})+({Param4}))*-1"/>
        </Request>
        <Response beanType="MedidorEstadoBean" validation="true">
        </Response>
    </Command>

    <Command>
        <key>I</key>
        <alias>isNobreakMonofasico</alias>
        <description>Detecta se o no-break é monofásico</description>
        <products>
            <product id="21760" vendor="1204"/>
        </products>
        <Request beanType="ComandoNobreak" tipoNoBreak="2" searchFor="3A#3a#3F#3f">
            <param name="Comando" type="binary" value="73"/>
            <param name="Param1" type="binary" value="-1"/>
            <param name="Param2" type="binary" value="-1"/>
            <param name="Param3" type="binary" value="-1"/>
            <param name="Param4" type="binary" value="-1"/>
            <param name="Check" type="check" calc="(({Comando})+({Param1})+({Param2})+({Param3})+({Param4}))*-1"/>
        </Request>
        <Response beanType="InformacoesBean" validation="true">
        </Response>
    </Command>

    <Command>
        <key>Q1</key>
        <alias>isNobreakSinusTriad</alias>
        <description>Resgata medidores e status do UPS</description>
        <products>
            <product id="0" vendor="-1"/>
        </products>
        <Request beanType="ComandoNobreak" tipoNoBreak="3">
            <param name="Comando" type="char" value="Q"/>
            <param name="Param1" type="char" value="1"/>
            <param name="CaracterInicial" type="char" value="("/>
            <param name="TamanhoResposta" type="int" value="47"/>
        </Request>
        <Response beanType="MedidorEstadoBean" validation="false" start="1">
        </Response>
    </Command>
</protocol>